{
  "kalshi_market_snapshot_id": "kms_a64e39e9a580e9065a5ecbef7baea712",
  "schema_version": "kalshi_market_snapshot.v1",
  "generated_at": "2026-05-11T00:00:00Z",
  "source_system": "kalshi",
  "source_fixture_path": "packages/strategy-dsl/fixtures/synthetic_kalshi_raw_market_snapshot.json",
  "adapter_contract_id": "krac_8e72c258a5e00a78b7e45b50a8e4f47f",
  "ingest_mode": "local_fixture_only",
  "paper_only": true,
  "live_execution_allowed": false,
  "order_placement_allowed": false,
  "credentials_used": false,
  "authenticated_request_used": false,
  "network_request_used": false,
  "market_ticker": "NBAPLAY-25-GSW-LKR-Y",
  "event_ticker": "NBAPLAY-25-GSW-LKR",
  "title": "Warriors vs Lakers: Golden State Warriors win (Game 1)?",
  "market_status": "open",
  "yes_ask_cents": 54,
  "yes_bid_cents": 52,
  "no_ask_cents": 48,
  "no_bid_cents": 46,
  "last_price_cents": 53,
  "volume": 18420,
  "open_interest": 9870,
  "expiration_time": "2026-05-12T05:00:00Z",
  "close_time": "2026-05-12T02:30:00Z",
  "result": null,
  "can_close_early": false,
  "data_quality_status": "complete",
  "ingest_warnings": [],
  "reason_code": "INGEST_COMPLETE",
  "reason": "local fixture ingested successfully"
}
